{
  "backend": {
    "commit": "d8f5bb22fae221a7a31ae45c953b64b375eeb316",
    "dirty": false
  },
  "candidate_id": "P0-B",
  "cores": [
    {
      "active": true,
      "core_id": 0,
      "decode": {
        "by_region": {
          "boot_rom": {
            "hits": 468640,
            "lookups": 469651,
            "misses": 1011
          },
          "immutable_xip": {
            "hits": 84484991,
            "lookups": 84704601,
            "misses": 219610
          },
          "other": {
            "hits": 0,
            "lookups": 0,
            "misses": 0
          },
          "sram": {
            "hits": 2600021,
            "lookups": 2602609,
            "misses": 2588
          },
          "xip_sram": {
            "hits": 0,
            "lookups": 0,
            "misses": 0
          }
        },
        "hits": 87553652,
        "lookups": 87776861,
        "misses": 223209,
        "noncacheable_fetches": 0
      },
      "emulated_cycles": 162105095,
      "exception": {
        "entries": 931,
        "polls": 87778723,
        "reject_active_handler": 0,
        "reject_no_candidate": 87728774,
        "reject_primask": 49018,
        "source": {
          "nvic": 931,
          "pendsv": 0,
          "systick": 0
        }
      },
      "handler_group": {
        "branch_system": 27314230,
        "data_processing": 26780446,
        "load_store": 28409323,
        "other": 2658845,
        "thumb16_shift_add_sub": 2560907,
        "thumb32": 53110
      },
      "invalidation": {
        "examined_slots": 4178832,
        "matching_clears": 0,
        "requests": 2089416,
        "unrelated_would_clear": 175269,
        "wide_predecessor_clears": 0
      },
      "invariants": {
        "valid": true
      },
      "overflowed": false,
      "pc_region": {
        "boot_rom": 469651,
        "immutable_xip": 84704601,
        "other": 0,
        "sram": 2602609,
        "xip_sram": 0
      },
      "retired_instructions": 87776861
    },
    {
      "active": false,
      "core_id": 1,
      "decode": {
        "by_region": {
          "boot_rom": {
            "hits": 0,
            "lookups": 0,
            "misses": 0
          },
          "immutable_xip": {
            "hits": 0,
            "lookups": 0,
            "misses": 0
          },
          "other": {
            "hits": 0,
            "lookups": 0,
            "misses": 0
          },
          "sram": {
            "hits": 0,
            "lookups": 0,
            "misses": 0
          },
          "xip_sram": {
            "hits": 0,
            "lookups": 0,
            "misses": 0
          }
        },
        "hits": 0,
        "lookups": 0,
        "misses": 0,
        "noncacheable_fetches": 0
      },
      "emulated_cycles": 0,
      "exception": {
        "entries": 0,
        "polls": 0,
        "reject_active_handler": 0,
        "reject_no_candidate": 0,
        "reject_primask": 0,
        "source": {
          "nvic": 0,
          "pendsv": 0,
          "systick": 0
        }
      },
      "handler_group": {
        "branch_system": 0,
        "data_processing": 0,
        "load_store": 0,
        "other": 0,
        "thumb16_shift_add_sub": 0,
        "thumb32": 0
      },
      "invalidation": {
        "examined_slots": 0,
        "matching_clears": 0,
        "requests": 0,
        "unrelated_would_clear": 0,
        "wide_predecessor_clears": 0
      },
      "invariants": {
        "valid": true
      },
      "overflowed": false,
      "pc_region": {
        "boot_rom": 0,
        "immutable_xip": 0,
        "other": 0,
        "sram": 0,
        "xip_sram": 0
      },
      "retired_instructions": 0
    }
  ],
  "counters": {
    "active": true,
    "decode": {
      "by_region": {
        "boot_rom": {
          "hits": 468640,
          "lookups": 469651,
          "misses": 1011
        },
        "immutable_xip": {
          "hits": 84484991,
          "lookups": 84704601,
          "misses": 219610
        },
        "other": {
          "hits": 0,
          "lookups": 0,
          "misses": 0
        },
        "sram": {
          "hits": 2600021,
          "lookups": 2602609,
          "misses": 2588
        },
        "xip_sram": {
          "hits": 0,
          "lookups": 0,
          "misses": 0
        }
      },
      "hits": 87553652,
      "lookups": 87776861,
      "misses": 223209,
      "noncacheable_fetches": 0
    },
    "emulated_cycles": 162105095,
    "exception": {
      "entries": 931,
      "polls": 87778723,
      "reject_active_handler": 0,
      "reject_no_candidate": 87728774,
      "reject_primask": 49018,
      "source": {
        "nvic": 931,
        "pendsv": 0,
        "systick": 0
      }
    },
    "handler_group": {
      "branch_system": 27314230,
      "data_processing": 26780446,
      "load_store": 28409323,
      "other": 2658845,
      "thumb16_shift_add_sub": 2560907,
      "thumb32": 53110
    },
    "invalidation": {
      "examined_slots": 4178832,
      "matching_clears": 0,
      "requests": 2089416,
      "unrelated_would_clear": 175269,
      "wide_predecessor_clears": 0
    },
    "pc_region": {
      "boot_rom": 469651,
      "immutable_xip": 84704601,
      "other": 0,
      "sram": 2602609,
      "xip_sram": 0
    },
    "retired_instructions": 87776861
  },
  "cpu": {
    "allowed_cpus": [
      11
    ],
    "cgroup_cpu_stat": {
      "burst_usec": 0,
      "nice_usec": 64724000,
      "nr_bursts": 0,
      "nr_periods": 0,
      "nr_throttled": 0,
      "system_usec": 5885816000,
      "throttled_usec": 0,
      "usage_usec": 137632004000,
      "user_usec": 131746188000
    },
    "cpu_pressure": {
      "full": {
        "avg10": 0.0,
        "avg300": 0.0,
        "avg60": 0.0,
        "total": 0.0
      },
      "some": {
        "avg10": 0.0,
        "avg300": 0.0,
        "avg60": 0.0,
        "total": 6676990106.0
      }
    },
    "kernel": "6.18.33.2-microsoft-standard-WSL2",
    "loadavg": [
      1.0,
      0.75439453125,
      0.41162109375
    ],
    "logical_cpus": 12,
    "model": "AMD Ryzen 5 5600X 6-Core Processor",
    "platform": "Linux-6.18.33.2-microsoft-standard-WSL2-x86_64-with-glibc2.39",
    "proc_cpu_stat": {
      "guest": 0,
      "guest_nice": 0,
      "idle": 287811766,
      "iowait": 70440,
      "irq": 0,
      "nice": 6472,
      "softirq": 208247,
      "steal": 0,
      "system": 380334,
      "user": 13168146
    },
    "reported_mhz": 3693.107,
    "scheduler": {
      "nice": 0,
      "policy": 0,
      "priority": 0
    }
  },
  "feature_set": [
    "cpu-application-profiler",
    "sd-gen1-multiblock"
  ],
  "interval": {
    "end_emulated_cycle": 827799818,
    "start_emulated_cycle": 0
  },
  "invariants": {
    "core_records_valid": true,
    "decode_lookup_conservation": true,
    "decode_region_conservation": true,
    "exception_poll_conservation": true,
    "exception_source_conservation": true,
    "handler_group_conservation": true,
    "pc_region_conservation": true,
    "valid": true
  },
  "overflowed": false,
  "profile_valid": true,
  "raw_profile": {
    "backend_build": {
      "commit": "d8f5bb22fae221a7a31ae45c953b64b375eeb316",
      "dirty": false
    },
    "cores": [
      {
        "active": true,
        "core_id": 0,
        "decode": {
          "by_region": {
            "boot_rom": {
              "hits": 468640,
              "lookups": 469651,
              "misses": 1011
            },
            "immutable_xip": {
              "hits": 84484991,
              "lookups": 84704601,
              "misses": 219610
            },
            "other": {
              "hits": 0,
              "lookups": 0,
              "misses": 0
            },
            "sram": {
              "hits": 2600021,
              "lookups": 2602609,
              "misses": 2588
            },
            "xip_sram": {
              "hits": 0,
              "lookups": 0,
              "misses": 0
            }
          },
          "hits": 87553652,
          "lookups": 87776861,
          "misses": 223209,
          "noncacheable_fetches": 0
        },
        "emulated_cycles": 162105095,
        "exception": {
          "entries": 931,
          "polls": 87778723,
          "reject_active_handler": 0,
          "reject_no_candidate": 87728774,
          "reject_primask": 49018,
          "source": {
            "nvic": 931,
            "pendsv": 0,
            "systick": 0
          }
        },
        "handler_group": {
          "branch_system": 27314230,
          "data_processing": 26780446,
          "load_store": 28409323,
          "other": 2658845,
          "thumb16_shift_add_sub": 2560907,
          "thumb32": 53110
        },
        "invalidation": {
          "examined_slots": 4178832,
          "matching_clears": 0,
          "requests": 2089416,
          "unrelated_would_clear": 175269,
          "wide_predecessor_clears": 0
        },
        "invariants": {
          "valid": true
        },
        "overflowed": false,
        "pc_region": {
          "boot_rom": 469651,
          "immutable_xip": 84704601,
          "other": 0,
          "sram": 2602609,
          "xip_sram": 0
        },
        "retired_instructions": 87776861
      },
      {
        "active": false,
        "core_id": 1,
        "decode": {
          "by_region": {
            "boot_rom": {
              "hits": 0,
              "lookups": 0,
              "misses": 0
            },
            "immutable_xip": {
              "hits": 0,
              "lookups": 0,
              "misses": 0
            },
            "other": {
              "hits": 0,
              "lookups": 0,
              "misses": 0
            },
            "sram": {
              "hits": 0,
              "lookups": 0,
              "misses": 0
            },
            "xip_sram": {
              "hits": 0,
              "lookups": 0,
              "misses": 0
            }
          },
          "hits": 0,